{
  "suite": "prekey-message",
  "version": 1,
  "encoding": "hex",
  "cases": [
    {
      "id": "E2E-VECTOR-002",
      "description": "PREKEY_MESSAGE associated-data, ciphertext, and encoding fixture",
      "inputs": {
        "version": 1,
        "senderDid": "did:agent:zFAe4sisG95oZ42w7buUn5qEE4TAnfTTFPiguZUHmhiF",
        "receiverDid": "did:agent:z3ogUn1GNXoASaRbxPNeVJnVv5rG4EPBtmQmX61jVorUe",
        "senderDeviceId": "device-a-01",
        "receiverDeviceId": "device-b-01",
        "sessionId": "sess_prekey_case_001",
        "messageId": "msg_prekey_case_001",
        "initiatorIdentityKey": "23b7bb8c91ae008711fb12846780bcdf1e065f821bdfec49f57e7c7dcd4c4823",
        "initiatorEphemeralKey": "392d174a38b3b1beafaf1fe824870841c5fa531bc6eafdb6402c124664488c1c",
        "recipientSignedPreKeyId": 7,
        "recipientOneTimePreKeyId": 19,
        "nonce": "000102030405060708090a0b0c0d0e0f1011121314151617",
        "plaintext": "68656c6c6f2066726f6d207072656b65792066697874757265",
        "contentKey": "737917b2e0a6d84cfd2c9392f8c580bbe88e853c9f00051611134b349ed45b2a"
      },
      "expected": {
        "associatedData": "b9000d6776657273696f6e0164747970656e5052454b45595f4d4553534147456973656e64657244696478366469643a6167656e743a7a464165347369734739356f5a343277376275556e357145453454416e66545446506967755a55486d6869466b726563656976657244696478376469643a6167656e743a7a336f67556e31474e586f415361526278504e65564a6e567635724734455042746d516d5836316a566f7255656e73656e64657244657669636549646b6465766963652d612d303170726563656976657244657669636549646b6465766963652d622d30316973657373696f6e496474736573735f7072656b65795f636173655f303031696d6573736167654964736d73675f7072656b65795f636173655f30303174696e69746961746f724964656e746974794b6579d840582023b7bb8c91ae008711fb12846780bcdf1e065f821bdfec49f57e7c7dcd4c482375696e69746961746f72457068656d6572616c4b6579d8405820392d174a38b3b1beafaf1fe824870841c5fa531bc6eafdb6402c124664488c1c77726563697069656e745369676e65645072654b65794964077818726563697069656e744f6e6554696d655072654b6579496413656e6f6e6365d8405818000102030405060708090a0b0c0d0e0f1011121314151617",
        "ciphertext": "7387a5d911ec80ea67e7fb55ea9f3588a78d5ef1534f152305324704883346c572635021dfb89a51c6",
        "encoded": "b9000e6776657273696f6e0164747970656e5052454b45595f4d4553534147456973656e64657244696478366469643a6167656e743a7a464165347369734739356f5a343277376275556e357145453454416e66545446506967755a55486d6869466b726563656976657244696478376469643a6167656e743a7a336f67556e31474e586f415361526278504e65564a6e567635724734455042746d516d5836316a566f7255656e73656e64657244657669636549646b6465766963652d612d303170726563656976657244657669636549646b6465766963652d622d30316973657373696f6e496474736573735f7072656b65795f636173655f303031696d6573736167654964736d73675f7072656b65795f636173655f30303174696e69746961746f724964656e746974794b6579d840582023b7bb8c91ae008711fb12846780bcdf1e065f821bdfec49f57e7c7dcd4c482375696e69746961746f72457068656d6572616c4b6579d8405820392d174a38b3b1beafaf1fe824870841c5fa531bc6eafdb6402c124664488c1c77726563697069656e745369676e65645072654b65794964077818726563697069656e744f6e6554696d655072654b6579496413656e6f6e6365d8405818000102030405060708090a0b0c0d0e0f10111213141516176a63697068657274657874d84058297387a5d911ec80ea67e7fb55ea9f3588a78d5ef1534f152305324704883346c572635021dfb89a51c6"
      }
    }
  ]
}
