{
  "suite": "session-message",
  "version": 1,
  "encoding": "hex",
  "cases": [
    {
      "id": "E2E-VECTOR-004",
      "description": "SESSION_MESSAGE associated-data, ciphertext, and encoding fixture",
      "inputs": {
        "version": 1,
        "senderDid": "did:agent:zFAe4sisG95oZ42w7buUn5qEE4TAnfTTFPiguZUHmhiF",
        "receiverDid": "did:agent:z3ogUn1GNXoASaRbxPNeVJnVv5rG4EPBtmQmX61jVorUe",
        "senderDeviceId": "device-a-01",
        "receiverDeviceId": "device-b-01",
        "sessionId": "sess_prekey_case_001",
        "messageId": "msg_session_case_001",
        "ratchetPublicKey": "6b3ee67463583cbe3dc08fe9d0765c2666ff5210dd527c9d8705e44927c80d55",
        "previousChainLength": 2,
        "messageNumber": 3,
        "nonce": "101112131415161718191a1b1c1d1e1f2021222324252627",
        "plaintext": "72617463686574207061796c6f61642066697874757265",
        "contentKey": "873b5b34d7159c87b0540a0d125516f01d03455546eff56db4ec2e2daab967c1"
      },
      "expected": {
        "associatedData": "b9000c6776657273696f6e0164747970656f53455353494f4e5f4d4553534147456973656e64657244696478366469643a6167656e743a7a464165347369734739356f5a343277376275556e357145453454416e66545446506967755a55486d6869466b726563656976657244696478376469643a6167656e743a7a336f67556e31474e586f415361526278504e65564a6e567635724734455042746d516d5836316a566f7255656e73656e64657244657669636549646b6465766963652d612d303170726563656976657244657669636549646b6465766963652d622d30316973657373696f6e496474736573735f7072656b65795f636173655f303031696d6573736167654964746d73675f73657373696f6e5f636173655f30303170726174636865745075626c69634b6579d84058206b3ee67463583cbe3dc08fe9d0765c2666ff5210dd527c9d8705e44927c80d557370726576696f7573436861696e4c656e677468026d6d6573736167654e756d62657203656e6f6e6365d8405818101112131415161718191a1b1c1d1e1f2021222324252627",
        "ciphertext": "38486672fd69005e208b6fb6b0ad7dfc32d5335de41200f3fb25294e77fe52413b2451d0886068",
        "encoded": "b9000d6776657273696f6e0164747970656f53455353494f4e5f4d4553534147456973656e64657244696478366469643a6167656e743a7a464165347369734739356f5a343277376275556e357145453454416e66545446506967755a55486d6869466b726563656976657244696478376469643a6167656e743a7a336f67556e31474e586f415361526278504e65564a6e567635724734455042746d516d5836316a566f7255656e73656e64657244657669636549646b6465766963652d612d303170726563656976657244657669636549646b6465766963652d622d30316973657373696f6e496474736573735f7072656b65795f636173655f303031696d6573736167654964746d73675f73657373696f6e5f636173655f30303170726174636865745075626c69634b6579d84058206b3ee67463583cbe3dc08fe9d0765c2666ff5210dd527c9d8705e44927c80d557370726576696f7573436861696e4c656e677468026d6d6573736167654e756d62657203656e6f6e6365d8405818101112131415161718191a1b1c1d1e1f20212223242526276a63697068657274657874d840582738486672fd69005e208b6fb6b0ad7dfc32d5335de41200f3fb25294e77fe52413b2451d0886068"
      }
    }
  ]
}
